{
  "title": "AZ-104 — Microsoft Azure Administrator Associate",
  "version": "1.0",
  "description": "50 hard questions covering Azure identities, storage, compute, networking, and monitoring. Updated 2026.",
  "timeLimit": 100,
  "shuffle": true,
  "passingScore": 70,
  "domains": [
    {"name": "Manage Azure Identities and Governance", "weight": 22},
    {"name": "Implement and Manage Storage", "weight": 17},
    {"name": "Deploy and Manage Azure Compute", "weight": 22},
    {"name": "Configure and Manage Virtual Networks", "weight": 25},
    {"name": "Monitor and Back Up Azure Resources", "weight": 14}
  ],
  "questions": [
    {
      "id": "AZ104-001",
      "domain": "Manage Azure Identities and Governance",
      "multiSelect": false,
      "question": "You manage an Azure subscription that contains 500 virtual machines across 50 resource groups. A new security policy mandates that all VMs must have a specific tag identifying the cost center. You need to apply this tag to all existing VMs without affecting running workloads. Which PowerShell command achieves this with the LEAST administrative effort?",
      "shuffleChoices": true,
      "choices": [
        {"text": "Get-AzResource -ResourceType 'Microsoft.Compute/virtualMachines' | ForEach-Object { Update-AzTag -ResourceId $_.ResourceId -Tag @{'CostCenter'='IT-001'} -Operation Merge }", "correct": true, "explanation": "Update-AzTag with the Merge operation adds the tag to existing resources without affecting other tags. Using Get-AzResource with a resource type filter targets only VMs across all resource groups in a single pipeline, minimizing administrative effort. This is a non-intrusive, in-place tag operation that does not restart VMs."},
        {"text": "Remove-AzTag -Name CostCenter; New-AzTag -Name CostCenter -Value IT-001; Apply-AzTag -ResourceId (Get-AzResource -ResourceType 'Microsoft.Compute/virtualMachines').ResourceId", "correct": false, "explanation": "Remove-AzTag removes the tag entirely before re-adding it — this would remove any existing CostCenter values from other resources. Apply-AzTag without the Merge operation overwrites all existing tags on the target resources."},
        {"text": "Get-AzVM | Set-AzResource -Tag @{'CostCenter'='IT-001'} -ApiVersion 2023-03-01", "correct": false, "explanation": "Set-AzResource on a VM object uses the VM's resource group scope but does not support direct pipeline input from Get-AzVM. This approach would require explicit resource group looping and would not efficiently target all 500 VMs across 50 resource groups."},
        {"text": " az resource list --resource-type Microsoft.Compute/virtualMachines --query '[].id' -o tsv | xargs -I {} az tag update --tag CostCenter=IT-001 --operation Merge --ids {}", "correct": true, "explanation": "az tag update with --operation Merge is the CLI equivalent of Update-AzTag — it adds the tag without removing existing tags. This command efficiently targets all VMs across subscriptions using a single pipeline."}
      ],
      "explanation": "Update-AzTag with -Operation Merge and a pipeline from Get-AzResource is the most efficient, non-disruptive way to tag 500 VMs across 50 resource groups. Merge preserves existing tags, preventing accidental data loss.",
      "tags": ["tags", "powershell", "resource-management"]
    },
    {
      "id": "AZ104-002",
      "domain": "Manage Azure Identities and Governance",
      "multiSelect": true,
      "selectCount": 2,
      "question": "Your company uses Microsoft Entra ID (formerly Azure AD) and Azure RBAC. You need to grant a contractor named Contractor1 access to manage only the virtual machines in ResourceGroup1, and nothing else. The access must expire automatically after 30 days. Which two steps achieve this?",
      "shuffleChoices": true,
      "choices": [
        {"text": "Create a Microsoft Entra ID user account for Contractor1 and configure the account with a set expiration date of 30 days from today.", "correct": true, "explanation": "Entra ID user accounts can have a set expiration date, after which the account is automatically disabled. This is the correct way to enforce automatic 30-day access expiry at the identity level."},
        {"text": "Assign the 'Virtual Machine Contributor' RBAC role to Contractor1 scoped at the ResourceGroup1 level only.", "correct": true, "explanation": "Virtual Machine Contributor at the resource group scope grants permission to manage VMs within that group and nothing else — it does not grant access to other resources, the VNet, storage, or subscription-level resources."},
        {"text": "Add Contractor1 to the 'Readers' group at the subscription level to ensure they can at least view all Azure resources before accessing VMs.", "correct": false, "explanation": "Adding the contractor to Readers at subscription level grants read access to ALL resources in the subscription, which violates least privilege. The VM Contributor role alone is sufficient for the stated requirement."},
        {"text": "Create an Azure Policy assignment at the subscription level that enforces VM tagging and configure a deny effect to block creation of untagged VMs.", "correct": false, "explanation": "Azure Policy controls resource creation compliance, not user access. This does not address the requirement to grant specific user access to specific VMs."}
      ],
      "explanation": "Virtual Machine Contributor at resource group scope + Entra ID account expiration date is the complete least-privilege solution with automatic 30-day expiry.",
      "tags": ["rbac", "entra-id", "least-privilege", "access"]
    },
    {
      "id": "AZ104-003",
      "domain": "Manage Azure Identities and Governance",
      "multiSelect": false,
      "question": "You are implementing Azure Policy to enforce that all storage accounts must use HTTPS traffic only and must be accessible only from specific trusted Microsoft Internet IP ranges. When you assign the policy, you discover that existing storage accounts are non-compliant. What is the correct sequence of steps to remediate the non-compliant storage accounts without disrupting existing applications?",
      "shuffleChoices": true,
      "choices": [
        {"text": "Run a policy remediation task to automatically update the 'enableHttpsTrafficOnly' and 'trustedAccess' properties on each non-compliant storage account. Verify the applications still function, then set the policy to 'Deny' for new resources to prevent future non-compliance.", "correct": true, "explanation": "Remediation tasks automatically fix existing resources to match policy definitions. Setting the policy to 'Audit' first allows you to assess impact before switching to 'Deny' — this sequence ensures existing apps are not disrupted. 'Deny' should only be applied after verifying remediation doesn't break workloads."},
        {"text": "Immediately set the Azure Policy to 'Deny' effect to block all non-compliant storage accounts, forcing immediate compliance. Investigate application impact in parallel.", "correct": false, "explanation": "Setting a Deny effect immediately blocks non-compliant resources — which would break existing applications using those storage accounts. The correct approach is remediation while still in Audit/Deny-NotSync, not immediate Deny enforcement on existing resources."},
        {"text": "Delete the non-compliant storage accounts and recreate them with the correct settings using an ARM template deployment that enforces the required properties.", "correct": false, "explanation": "Deleting and recreating storage accounts is extremely disruptive — it destroys all stored data and breaks all application references. Policy remediation can update storage account properties in-place without data loss."},
        {"text": "Export the list of non-compliant storage accounts, create a support ticket for each account owner to manually update their storage accounts within 24 hours, and set the policy to 'Disabled' to pause enforcement during the remediation window.", "correct": false, "explanation": "Manual remediation by account owners is slow, inconsistent, and error-prone. Azure Policy's remediation task automates this at scale. Disabling the policy entirely removes enforcement during the critical remediation window."}
      ],
      "explanation": "Policy remediation tasks update resources in-place with a controlled sequence (Audit → remediate → verify → Deny), ensuring existing applications are not disrupted by automatic compliance fixes.",
      "tags": ["azure-policy", "remediation", "storage-accounts"]
    },
    {
      "id": "AZ104-004",
      "domain": "Manage Azure Identities and Governance",
      "multiSelect": false,
      "question": "Your organization has a Microsoft Entra ID tenant with 2,000 users. You need to grant members of the 'Project-Delta' group access to three Azure Storage accounts, but ONLY during business hours (Monday-Friday, 9 AM to 6 PM UTC). Outside of business hours, all access must be denied. How should you implement this?",
      "shuffleChoices": true,
      "choices": [
        {"text": "Create a Conditional Access policy targeting the Project-Delta group, with a session control that enforces a custom frequency of access (sign-in frequency = 1 hour) during the configured times (Monday-Friday, 9 AM-6 PM UTC). Enable the policy with a grant control requiring compliant device.", "correct": false, "explanation": "Conditional Access sign-in frequency controls how often a user must re-authenticate, not whether they can access resources at all during specific hours. This does not achieve time-based access restriction — it only controls re-authentication frequency."},